{
    "eventId": "123e4567-e89b-12d3-a456-426614174000",
    "eventName": "OrderReceived",
    "timestamp": "2024-12-16T12:34:56Z",
    "eventBody": {
        "orderId": "ORD-20241216-0001",
        "customerId": "CUST-1001",
        "orderDate": "2024-12-16T12:30:00Z",
        "items": [
            {
                "itemId": "ITEM-001",
                "quantity": 2,
                "price": 25.50
            },
            {
                "itemId": "ITEM-002",
                "quantity": 1,
                "price": 15.75
            }
        ],
        "totalAmount": 66.75
    }
}